process_id,language,rephrased_query
23257862_4,da,Jeg vil gerne downloade tekstindholdet fra https://www.example.com/article og generere både et billede og en lydfil baseret på tekstindholdet.
23257862_5,fr,Je voudrais télécharger le contenu textuel de https://www.example.com/article et générer à la fois une image et un fichier audio basé sur le contenu textuel.
18284019_0,en,"I have two images, example1.jpg and example2.jpg. I want to make a slideshow video from these images, then stabilize the video for a smoother viewing experience, and finally extract the audio track from the video."
18284019_1,en,"Using my two images, example1.jpg and example2.jpg, I'd like to create a slideshow video. Subsequently, I want the video to be stabilized and the audio track to be extracted."
18284019_2,en,"I need to create a slideshow video from two images, example1.jpg and example2.jpg, stabilize the video, and extract the audio track."
18284019_3,da,"Jeg har to billeder, example1.jpg og example2.jpg, og jeg vil gerne lave en diasshow-video med disse billeder. Derefter har jeg brug for at ekstrahere lydsporet fra denne video. Til sidst vil jeg sætte pris på, hvis videoen kan stabiliseres for en glattere visningsoplevelse."
18284019_4,fr,"J'ai deux images, example1.jpg et example2.jpg, et je voudrais créer une vidéo de diaporama avec ces images. Après cela, j'ai besoin que la piste audio soit extraite de cette vidéo. Enfin, j'apprécierais que la vidéo puisse être stabilisée pour une expérience de visionnement plus douce."
98091767_0,en,"Can you download a video from this URL, add a voiceover using this text, and then transcribe the speech?"
98091767_1,en,"I need a video downloaded from this URL, a voiceover added from this text, and the speech transcribed."
98091767_2,en,"Please download this video, create a voiceover from this text, and transcribe the speech."
98091767_3,da,"Jeg har en URL til en video, example.mp4, som jeg vil tilføje en voiceover til. Voiceover-teksten er: 'Dette er en eksempel voiceover'. Når voiceoveren er tilføjet, skal du transskribere talen fra videoen til en tekstfil."
98091767_4,fr,"J'ai une URL d'une vidéo, example.mp4, à laquelle je veux ajouter une voix off. Le texte de la voix off est : 'Ceci est un exemple de voix off'. Une fois la voix off ajoutée, veuillez transcrire le discours de la vidéo en un fichier texte."
57973781_0,en,"Can you create some topics from this text: 'The increasing applications of artificial intelligence and machine learning have brought significant advancements in various sectors, including healthcare, finance, and education.' and then pull out their relevant URLs and find related videos?"
57973781_1,en,"From this text: 'The increasing applications of artificial intelligence and machine learning have brought significant advancements in various sectors, including healthcare, finance, and education.', could you generate topics, find related videos, and then extract their URLs?"
57973781_2,en,"I need some topics generated from this text: 'The increasing applications of artificial intelligence and machine learning have brought significant advancements in various sectors, including healthcare, finance, and education.', and then I need you to search for related videos and extract their URLs."
57973781_3,da,"Jeg har et dokument med følgende tekst: 'Den stigende anvendelse af kunstig intelligens og maskinlæring har medført betydelige fremskridt inden for forskellige sektorer, herunder sundhed, finans og uddannelse.' Kan du generere nogle emner til yderligere forskning eller udforskning og give mig deres relevante URL'er og videoer?"
57973781_4,fr,"J'ai un document avec le texte suivant: 'L'application croissante de l'intelligence artificielle et de l'apprentissage automatique a apporté des avancées significatives dans divers secteurs, y compris la santé, la finance et l'éducation.' Pouvez-vous générer des sujets pour des recherches ou des explorations supplémentaires et me fournir leurs URL et vidéos pertinentes?"
27412468_0,en,I need a video made from images generated from the text 'The qick brown fox jumps ovor the lazy dog' and the audio from 'example.wav' file.
27412468_1,en,Can you create a video from images that are generated from the text 'The qick brown fox jumps ovor the lazy dog' and the audio from 'example.wav' file?
27412468_2,en,Generate a video from images that are created from the text 'The qick brown fox jumps ovor the lazy dog' and the audio from 'example.wav' file.
27412468_3,da,"Jeg vil gerne lave en diasshow video ved hjælp af et billede genereret fra teksten 'The qick brown fox jumps ovor the lazy dog' og et billede, der repræsenterer lyden fra 'example.wav' filen."
27412468_4,fr,Je veux créer une vidéo de diaporama à l'aide d'une image générée à partir du texte 'The qick brown fox jumps ovor the lazy dog' et d'une image représentant l'audio du fichier 'example.wav'.
26105740_0,en,"Can you first paraphrase this text 'What a beautiful day to go outside and enjoy nature! Check out this website www.example.com for great outdoor activities.', then analyze its sentiment, extract any URLs, and create a video based on the paraphrased text?"
26105740_1,en,"I need you to first paraphrase this text, then extract any URLs, analyze its sentiment, and finally create a video."
26105740_2,en,"Please paraphrase this text, then extract any URLs, analyze its sentiment, and create a video."
26105740_3,da,"Kan du først parafrasere denne tekst 'Hvilken smuk dag at gå udenfor og nyde naturen! Tjek denne hjemmeside www.example.com for fantastiske udendørs aktiviteter.', derefter analysere dens sentiment, udtrække eventuelle URL'er, og skabe en video baseret på den parafraserede tekst?"
26105740_4,fr,"Pouvez-vous d'abord paraphraser ce texte 'Quelle belle journée pour sortir et profiter de la nature! Consultez ce site www.example.com pour de superbes activités de plein air.', puis analyser son sentiment, extraire les URL et enfin créer une vidéo basée sur le texte paraphrasé?"
34001341_0,en,"I need to make a video presentation using two images (example.jpg, example2.png) and a script. The video should be synchronized with a voiceover (example.wav) and the speed should be adjusted based on the script. Script: 'Artificial intelligence is transforming various industries and enabling innovative solutions. The future of AI presents numerous opportunities and challenges. In this presentation, we will discuss the potential impact of AI on our society.'"
34001341_1,en,"I'm preparing a presentation and I have a script and two images (example.jpg, example2.png). I want to create a video that is synchronized with a voiceover (example.wav) and the speed is adjusted according to the script. Script: 'Artificial intelligence is transforming various industries and enabling innovative solutions. The future of AI presents numerous opportunities and challenges. In this presentation, we will discuss the potential impact of AI on our society.'"
34001341_2,da,"Jeg forbereder en præsentation og har brug for at lave en video baseret på billeder og et manuskript. Jeg vil synkronisere voiceover (example.wav) med slideshowet og justere hastigheden i henhold til følgende manuskript. Sørg for, at den endelige video er synkroniseret med manuskriptet. Manuskript: 'Kunstig intelligens transformerer forskellige industrier og muliggør innovative løsninger. Fremtiden for AI præsenterer mange muligheder og udfordringer. I denne præsentation vil vi diskutere den potentielle indvirkning af AI på vores samfund.' Billeder: example.jpg, example2.png"
34001341_3,fr,"Je prépare une présentation et j'ai besoin de créer une vidéo basée sur des images et un script. Je veux synchroniser la voix off (example.wav) avec le diaporama et ajuster la vitesse selon le script suivant. Assurez-vous que la vidéo finale est synchronisée avec le script. Script : 'L'intelligence artificielle transforme diverses industries et permet des solutions innovantes. L'avenir de l'IA présente de nombreuses opportunités et défis. Dans cette présentation, nous discuterons de l'impact potentiel de l'IA sur notre société.' Images : example.jpg, example2.png"
33846084_0,en,I have an article on the benefits of a healthy lifestyle and a video. Can you make a video with a voiceover that summarizes the main points of the article?
33846084_1,en,Can you help me create a video with a voiceover that summarizes a lengthy article I have about the benefits of a healthy lifestyle using an example.mp4 video I have?
33846084_2,en,I need a video with a voiceover that covers the main points of a lengthy article I have about the benefits of a healthy lifestyle. I also have an example.mp4 video that you can use.
33846084_3,da,"Jeg har en lang artikel om fordelene ved en sund livsstil og en eksempel.mp4 video, som jeg gerne vil bruge til en uddannelsesvideo. Kan du lave en kort og omfattende video med voiceover, der dækker hovedpunkterne i artiklen?"
33846084_4,fr,J'ai un long article sur les avantages d'un mode de vie sain et une vidéo exemple.mp4 que j'aimerais utiliser pour une vidéo éducative. Pouvez-vous créer une vidéo concise et complète avec une voix off qui couvre les points principaux de l'article?
21878474_0,en,Can you paraphrase my request and then find text and video content on the health benefits of green tea?
21878474_1,en,"I need information on the health benefits of green tea in text and video formats, but paraphrase my request first."
21878474_2,en,"After paraphrasing my request, can you find text and video information on the health benefits of green tea?"
21878474_3,en,Paraphrase my request and then search for text and video content on the health benefits of green tea.
21878474_4,da,Kan du omskrive min anmodning og derefter finde tekst og videoindhold om sundhedsfordelene ved at drikke grøn te?
21878474_5,fr,Veuillez paraphraser ma demande et ensuite trouver du contenu textuel et vidéo sur les bienfaits du thé vert pour la santé.
10213034_0,en,"I want to extract an image from 'example.mp4', use it to search for a similar image, stitch that image with 'example.jpg' to create a panorama, and then apply the style from 'example_style.jpg' to the panorama."
10213034_1,en,"Can you help me create a panorama by stitching 'example.jpg' with an image from a similar image search using an image extracted from 'example.mp4', and then apply the style from 'example_style.jpg'?"
10213034_2,en,I would like to apply the style from 'example_style.jpg' to a panorama created by stitching 'example.jpg' with an image from a similar image search using an image extracted from 'example.mp4'.
10213034_3,da,"Jeg vil gerne trække et billede ud af 'example.mp4', bruge det til at søge efter et lignende billede, sy det billede sammen med 'example.jpg' for at skabe et panorama, og derefter anvende stilen fra 'example_style.jpg' på panoramaet."
10213034_4,fr,"Je voudrais extraire une image de 'example.mp4', l'utiliser pour rechercher une image similaire, assembler cette image avec 'example.jpg' pour créer un panorama, puis appliquer le style de 'example_style.jpg' au panorama."
89666972_0,en,I need a panorama made by stitching a still image from a video mentioned in example.mp4 and another image example.jpg.
89666972_1,en,Can you create a panorama using a still image extracted from a video in example.mp4 and another image example.jpg?
89666972_2,en,"I'd like to generate a panorama by combining a still image from a video that's in example.mp4 with another image, which is example.jpg."
89666972_3,en,"Using a still image from a video mentioned in example.mp4 and another image example.jpg, can you create a panorama?"
89666972_4,da,"Jeg vil gerne lave et panorama ved at kombinere et stillbillede fra en video, der er nævnt i example.mp4, med et andet billede: example.jpg."
89666972_5,fr,Je veux créer une image panoramique en combinant l'image fixe d'une vidéo mentionnée dans example.mp4 avec une autre image: example.jpg.
31876257_0,en,"Can you create a slideshow video using two images: one that is the result of applying the visual style of 'example1.jpg' to 'example2.jpg' and then colorizing it, and the other being a still image extracted from 'example.mp4'?"
31876257_1,en,"I need a slideshow video made from two images: the first is 'example2.jpg' with the style of 'example1.jpg' applied and then colorized, and the second is a still image from 'example.mp4'."
31876257_2,en,"Please generate a slideshow video using two images: the first is 'example2.jpg' styled like 'example1.jpg' and colorized, and the second is a still image taken from 'example.mp4'."
31876257_3,da,"Kan du lave en diasshow video ved hjælp af to billeder: det første er resultatet af at anvende den visuelle stil fra 'example1.jpg' til 'example2.jpg' og derefter farvelægge det, og det andet er et stillbillede trukket ud fra 'example.mp4'?"
31876257_4,fr,"Pouvez-vous créer une vidéo de diaporama à l'aide de deux images : la première est le résultat de l'application du style visuel de 'example1.jpg' à 'example2.jpg' puis colorisée, et la seconde est une image fixe extraite de 'example.mp4' ?"
26753516_0,en,Can you extract the URL from the text in the image 'example.jpg' and convert the text to an audio file?
26753516_1,en,I need the text in the image 'example.jpg' converted to an audio file and the URL in the text extracted.
26753516_2,en,Please convert the text in 'example.jpg' to an audio file and also extract the URL.
26753516_3,en,Extract the URL from the text in 'example.jpg' and then convert the text to an audio file.
26753516_4,da,Jeg har et billede 'example.jpg' der indeholder tekst og en URL i teksten. Jeg har brug for at URL'en bliver trukket ud og teksten konverteret til en lydfil.
26753516_5,fr,J'ai une image 'example.jpg' contenant du texte et une URL dans le texte. J'ai besoin que l'URL soit extraite et que le texte soit converti en fichier audio.
34004480_0,en,"Can you download two black and white images from these URLs, stitch them together, colorize the stitched image, perform an image search with it, and generate topics from the text in the resulting image?"
34004480_1,en,"I need to download two black and white images from these URLs, combine them into one, colorize it, find similar images, and extract topics from the text in the images."
34004480_2,en,"Using these two URLs, can you download the black and white images, merge them, add color to the merged image, search for similar images, and provide topics from the text in the images?"
34004480_3,da,"Jeg har to URL'er af sort-hvide billeder, jeg vil gerne sy dem sammen, farvelægge det endelige output, derefter udføre en billedsøgning og hente nogle relevante emner fra eventuel tekst fundet i det resulterende billede."
34004480_4,fr,"J'ai deux URL d'images en noir et blanc, je voudrais les assembler, coloriser le résultat final, puis effectuer une recherche d'image et récupérer des sujets pertinents à partir de tout texte associé trouvé dans l'image résultante."
33676750_0,en,"I need to make a video from two images (example.jpg and example2.jpg), then get a still image and an audio track from the video, and create a waveform image from the audio."
33676750_1,en,"Can you help me create a video using two images (example.jpg and example2.jpg), extract a still image and an audio track from it, and then generate a waveform image from the audio?"
33676750_2,da,"Jeg vil gerne lave en diasshow-video ved hjælp af to billeder (example.jpg og example2.jpg), derefter udtrække et stillbillede, en lydspor, og generere et bølgeformbillede fra diasshow-videoen."
33676750_3,fr,"Je veux créer une vidéo de diaporama à l'aide de deux images (example.jpg et example2.jpg), puis extraire une image fixe, une piste audio, et générer une image de forme d'onde à partir de la vidéo de diaporama."
76614259_0,en,"Can you take the video 'example.mp4', extract the audio, create a waveform image saved as 'example.png', and modify the audio to have a higher pitch, saving it as 'example_modified.wav'?"
76614259_1,en,"I need the audio from 'example.mp4' extracted, a waveform image of it created and saved as 'example.png', and the audio pitch increased and saved as 'example_modified.wav'."
76614259_2,en,"Extract the audio from 'example.mp4', then generate a waveform image and save it as 'example.png'. In addition to that, change the pitch of the audio to a higher level and save it as 'example_modified.wav'."
76614259_3,da,Jeg vil gerne have dig til at behandle videofilen 'example.mp4' og udtrække dens lydspor. Derefter skal du generere et waveform-billede af den udtrukne lyd og gemme det som 'example.png'. Ændre også den udtrukne lyd ved at ændre dens pitch til et højere niveau og gem outputtet som 'example_modified.wav'.
76614259_4,fr,"Je veux que vous traitiez le fichier vidéo 'example.mp4' et extrayiez sa piste audio. Après cela, veuillez générer une image de forme d'onde de l'audio extrait et l'enregistrer en tant que 'example.png'. Modifiez également l'audio extrait en augmentant son pitch et enregistrez le résultat en tant que 'example_modified.wav'."
30592055_0,en,"Can you transcribe the speech from my video file, summarize it, and then simplify it?"
30592055_1,en,"I need the speech from my video file transcribed, summarized, and then simplified."
30592055_2,en,"Could you please transcribe my video file, then summarize and simplify the text?"
30592055_3,da,"Jeg har en videofil kaldet example.mp4. Jeg vil gerne transskribere talen fra videofilen til tekst, opsummere den tekst til en kortere version, mens jeg bevarer hovedpunkterne, og omskrive teksten på en enklere og mere forståelig måde."
30592055_4,fr,"J'ai un fichier vidéo appelé example.mp4. Je voudrais transcrire le discours du fichier vidéo en texte, résumer ce texte en une version plus courte tout en conservant les points principaux, et réécrire le texte de manière plus simple et plus compréhensible."
28199695_0,en,"Could you please download the audio from this link in my text, change the voice to sound like a female, and then generate a waveform image of it?"
28199695_1,en,"I need you to extract the URL from this text, download the audio, modify the voice to sound female, and create a waveform image."
28199695_2,en,"Can you take this URL from my text, download the audio, change the voice to a female one, and make a waveform image?"
28199695_3,da,"Kan du tage denne URL fra min tekst, downloade lyden, ændre stemmen til en kvindelig en, og lave et waveform billede?"
28199695_4,fr,"Pouvez-vous prendre cette URL de mon texte, télécharger l'audio, changer la voix en une voix féminine, et créer une image de forme d'onde?"
25688318_0,en,"Can you download an image from this URL, extract any text on it, and then use it with another image to create a slideshow video?"
25688318_1,en,"I need to download an image from a URL, extract its text, and make a slideshow video with another image."
25688318_2,en,"Please download an image from this URL, then use it and another image to make a slideshow video, and also extract any text from the downloaded image."
25688318_3,da,"Jeg vil gerne downloade et billede fra denne URL, udtrække eventuel tekst på billedet ved hjælp af OCR og derefter lave en diasshow-video ved hjælp af dette downloadede billede og et andet billede 'example.jpg'. (Danish)"
25688318_4,fr,"Je veux télécharger une image à partir de cette URL: 'https://www.example.com/image.jpg', extraire tout texte présent sur l'image en utilisant OCR et ensuite créer une vidéo de diaporama en utilisant cette image téléchargée et une autre image 'example.jpg'. (French)"
28058323_0,en,"I need to make a video presentation with a voiceover using the content from a specific URL. The video's speed should be adjusted according to my instructions and a still image should be extracted from the final video. Resource files: url: 'https://www.example.com/article', video: 'example.mp4', user's instruction: 'increase speed by 10%'"
28058323_1,en,"Can you help me create a video presentation? I want to use the content from a URL, add a voiceover, adjust the video's speed as per my instructions, and extract a still image from the final video. Resource files: url: 'https://www.example.com/article', video: 'example.mp4', user's instruction: 'increase speed by 10%'"
28058323_2,da,"Jeg vil gerne lave en video præsentation med en voiceover ved hjælp af indholdet fra en given URL. Præsentationen skal have den modificerede video's afspilningshastighed som per min instruktion og også give et stillbillede udtrukket fra den endelige video. Ressourcefiler: url: 'https://www.example.com/article', video: 'example.mp4', brugerens instruktion: 'øg hastigheden med 10%'"
28058323_3,fr,"Je veux créer une présentation vidéo avec une voix off en utilisant le contenu d'une URL donnée. La présentation doit avoir la vitesse de lecture de la vidéo modifiée selon mes instructions et fournir également une image fixe extraite de la vidéo finale. Fichiers de ressources: url: 'https://www.example.com/article', vidéo: 'example.mp4', instruction de l'utilisateur: 'augmenter la vitesse de 10%'"
28769531_0,en,Create a slideshow video using an image from this URL https://example.com/image.jpg and another image generated from the text 'Example: DeepAI'.
28769531_1,en,I need a slideshow video that combines an image I will download from a URL and an image generated from the text 'Example: DeepAI'. The image URL is https://example.com/image.jpg.
28769531_2,en,Can you make a slideshow video with an image downloaded from https://example.com/image.jpg and an image created from the text 'Example: DeepAI'?
28769531_3,da,"Jeg vil gerne lave en diasshow video, der fusionerer et billede downloadet fra en URL og et billede oprettet med teksten 'Eksempel: DeepAI'. Billedets URL: https://example.com/image.jpg."
28769531_4,fr,Je veux créer une vidéo de diaporama fusionnant une image téléchargée à partir d'une URL et une image créée avec le texte 'Exemple: DeepAI'. L'URL de l'image: https://example.com/image.jpg.
28687369_0,en,"Download the audio file from this URL, generate a waveform image, change the audio to sound like a female with a high pitch, and apply the style of this image to the waveform."
28687369_1,en,"I want to download an audio file, create a waveform image, change the audio to sound like a female with a high pitch, and apply the style of a specific image to the waveform."
28687369_2,en,Please apply the style of a specific image to a waveform image that is created from an audio file that has been downloaded and modified to sound like a female with a high pitch.
28687369_3,da,"Hent lydfilen fra denne URL, generer et waveform-billede, ændr lyden til at lyde som en kvinde med en høj tone, og anvend stilen fra dette billede på waveform-billedet. (Danish)"
28687369_4,fr,"Veuillez télécharger le fichier audio à partir de cette URL, créer une image de forme d'onde, modifier l'audio pour avoir un ton plus élevé et une voix féminine, et enfin appliquer le style visuel de 'example.jpg' à l'image de forme d'onde. (French)"
23389437_0,en,"I want to make a video slideshow from my audio file example.wav and two images example1.jpg and example2.jpg. First, turn the audio into a visual representation, then colorize example1.jpg. Stitch these two images together to make a panoramic collage, and use this collage and example2.jpg to create the slideshow."
23389437_1,en,"Can you help me create a video slideshow? I have an audio file, example.wav, and two images, example1.jpg and example2.jpg. I'd like the audio to be turned into an image, example1.jpg to be colorized, and these two images to be stitched together. Then use the collage and example2.jpg to make the slideshow."
23389437_2,en,"Using my audio file example.wav and two images example1.jpg and example2.jpg, I'd like to create a video slideshow. The audio should be visually represented, example1.jpg should be colorized, and these images should be stitched together. The resulting collage and example2.jpg should be used for the slideshow."
23389437_3,da,"Jeg har en lydfil example.wav og to billeder example1.jpg og example2.jpg. Jeg vil gerne lave en videodiasvisning, der viser en visuelt tiltalende repræsentation af min lydfil (example.wav) og billederne (example1.jpg og example2.jpg). Generer venligst en panoramisk collage med en visuelt repræsenteret lyd på den ene side og den farvelagte version af det monokrome billede på den anden."
23389437_4,fr,J'ai un fichier audio example.wav et deux images example1.jpg (qui est une image monochrome) et example2.jpg. Je veux créer un diaporama vidéo qui présente une représentation visuellement attrayante de mon fichier audio (example.wav) et des images (example1.jpg et example2.jpg). Veuillez générer un collage panoramique avec une représentation audio visuelle d'un côté et la version colorisée de l'image monochrome de l'autre.
18415345_0,en,"Can you paraphrase this text, then search the paraphrased version online, after that check the grammar of the results, and finally extract any URLs?"
18415345_1,en,"I need to paraphrase this text, next search the paraphrased version on the internet, then check the grammar of the results, and finally extract any URLs."
18415345_2,en,"Paraphrase this text, search the paraphrased text on the internet, check the grammar of the results, and extract any URLs."
18415345_3,da,"Jeg har en tekst 'Forureningsniveauerne er steget dramatisk, hvilket skader menneskers sundhed og miljøet. Tag passende skridt for en renere og grønnere planet.' Jeg har brug for dens omskrevne version, søg den på internettet, tjek grammatikken, og træk URL'er ud fra resultaterne."
