process_id,language,rephrased_query
49391585_4,fr,"J'ai besoin de télécharger une image de 'https://example.com/image.jpg', d'extraire tout texte présent dans l'image, et d'appliquer le style d'une autre image 'example_style.jpg'. Après le processus, je veux aussi connaître les phrases/mots clés du texte extrait."
10557009_0,en,"Can you generate an audio file from this text: 'Congratulations on your achievement! Keep up the good work.' and alter its voice to sound like a cheerful female? Also, I have an audio file (example.wav) with some noise, can you eliminate the noise and merge it with the voice audio?"
10557009_1,en,I have a text: 'Congratulations on your achievement! Keep up the good work.' that I want to convert into an audio file with a cheerful female voice. I also have an audio file (example.wav) that needs noise reduction. Can you combine these two audios into one?
10557009_2,en,"Please create an audio from the text: 'Congratulations on your achievement! Keep up the good work.' and change its voice to a cheerful female. Also, remove the noise from my example.wav file and combine it with the voice audio."
10557009_3,da,"Jeg har brug for at skabe en ny lydfil fra følgende tekst: 'Tillykke med din præstation! Fortsæt det gode arbejde.' Ændr venligst dens stemmetone, tonehøjde og køn for at matche en glad kvindelig stemme. Jeg har også en example.wav fil, der har noget baggrundsstøj, fjern venligst støjen og kombiner den med den genererede stemme."
10557009_4,fr,"J'ai besoin de créer un nouveau fichier audio à partir du texte suivant : 'Félicitations pour votre réalisation ! Continuez le bon travail.' Veuillez modifier son ton de voix, sa hauteur et son genre pour correspondre à une voix féminine joyeuse. De plus, j'ai un fichier example.wav qui a du bruit de fond, veuillez enlever le bruit et le combiner avec la voix générée."
33129048_0,en,"I want to extract the audio from my video file 'example.mp4', change the pitch of my audio file 'example.wav', and merge them into one file."
33129048_1,en,"Can you help me get the audio from my video file 'example.mp4', alter the pitch of my audio file 'example.wav', and combine them?"
33129048_2,en,"I have an audio file 'example.wav' and a video file 'example.mp4'. Can you change the pitch of the audio, extract the audio from the video, and merge them?"
33129048_3,en,"Extract the audio from my video file 'example.mp4', then change the pitch of my audio file 'example.wav', and after that, merge them into one file."
33129048_4,da,"Jeg har en videofil 'example.mp4' og en lydfil 'example.wav'. Jeg vil gerne have en lydspor fra videoen, ændre stemmen i 'example.wav' til en højere tone, og kombinere dem sammen til en enkelt outputfil."
33129048_5,fr,"J'ai un fichier vidéo 'example.mp4' et un fichier audio 'example.wav'. Je voudrais obtenir une piste audio de la vidéo, modifier la voix dans 'example.wav' à un ton plus élevé, et les combiner ensemble dans un seul fichier de sortie."
28960855_0,en,"I need to alter the wording of an article, search for a related image, and convert the altered text into an audio file. Here is the original article text: ..."
28960855_1,en,"Can you help me find an image related to this article, rewrite the article, and then convert the rewritten text into an audio file? Here is the original article text: ..."
28960855_2,da,"Jeg har brug for at omskrive en artikel, finde et billede relateret til artiklen og omdanne den omskrevne tekst til en lydfil. Her er den originale artikeltekst: ..."
28960855_3,fr,"J'ai besoin d'aide pour reformuler un article, trouver une image liée à l'article et transformer le texte réécrit en fichier audio. Voici le texte original de l'article: ..."
28048541_0,en,"Can you stabilize the video 'example.mp4', extract an image from it, generate an image from the audio 'example.wav', and then combine these images?"
28048541_1,en,"I need the video 'example.mp4' stabilized, an image extracted from it, an image created from the audio 'example.wav', and these images stitched together."
28048541_2,en,"Stabilize the video 'example.mp4', extract an image, create an image from the audio 'example.wav', and stitch the images together, please."
28048541_3,da,"Kan du stabilisere videoen 'example.mp4', udtrække et billede fra den, generere et billede fra lydfilen 'example.wav', og derefter kombinere disse billeder?"
28048541_4,fr,"Pouvez-vous stabiliser la vidéo 'example.mp4', extraire une image de celle-ci, générer une image à partir du fichier audio 'example.wav', et ensuite combiner ces images?"
13641817_0,en,I need a slideshow video for my presentation with the first slide being an image generated from the text 'The impact of climate change on ecosystems' and the second slide being the example.jpg image. The video should then be synchronized with the example.wav audio file.
13641817_1,en,"I want to synchronize the example.wav audio file with a slideshow video for my presentation. The video should have two slides, with the first one being an image generated from the text 'The impact of climate change on ecosystems' and the second one being the example.jpg image."
13641817_2,en,"Can you create a slideshow video for my presentation? The first slide should be an image generated from the text 'The impact of climate change on ecosystems' and the second slide should be the example.jpg image. Also, can you synchronize the video with the example.wav audio file?"
13641817_3,da,Jeg vil gerne lave en diasshowvideo til min præsentation. Den første dias skal være baseret på teksten: 'Klimaændringers indvirkning på økosystemer.' Den anden dias skal være example.jpg-billedet. Synkroniser den medfølgende example.wav-lydfil med videoen.
13641817_4,fr,Je veux créer une vidéo de diaporama pour ma présentation. La première diapositive doit être basée sur le texte: 'L'impact du changement climatique sur les écosystèmes.' La deuxième diapositive doit être l'image example.jpg. Synchronisez le fichier audio example.wav fourni avec la vidéo.
10816606_0,en,"Can you download the audio from 'https://www.example.com/audio.wav', extract keywords from 'I want the voice to sound more cheerful and enthusiastic', and then change the voice of the audio based on these keywords?"
10816606_1,en,"Please download the audio file from this URL: 'https://www.example.com/audio.wav'. After that, extract the keywords from this text: 'I want the voice to sound more cheerful and enthusiastic'. Finally, use these keywords to modify the voice of the downloaded audio."
10816606_2,en,"I need to download an audio file from 'https://www.example.com/audio.wav', extract important phrases from 'I want the voice to sound more cheerful and enthusiastic', and adjust the voice of the audio using these phrases."
10816606_3,da,Jeg vil gerne downloade lydfilen fra denne URL: 'https://www.example.com/audio.wav' og ændre stemmekarakteristika baseret på nøgleordene fundet i denne tekst: 'Jeg vil gerne have stemmen til at lyde mere munter og entusiastisk.' Brug venligst de angivne værktøjer til at fuldføre denne opgave.
10816606_4,fr,Je voudrais télécharger le fichier audio de cette URL: 'https://www.example.com/audio.wav' et changer les caractéristiques de la voix en fonction des mots-clés trouvés dans ce texte: 'Je veux que la voix soit plus joyeuse et enthousiaste.' Veuillez utiliser les outils fournis pour accomplir cette tâche.
28344809_0,en,"Can you turn my text file 'example.txt' into a video, stabilize it, transcribe the speech, and add a voiceover using the transcribed text?"
28344809_1,en,"I'd like to generate a video from my text file 'example.txt', stabilize the video, transcribe the speech from the video, and add a voiceover using the transcribed text."
28344809_2,en,"Please create a video from my text file 'example.txt', stabilize the video, transcribe the speech from the video, and add a voiceover using the transcribed text."
28344809_3,da,"Jeg vil gerne konvertere min tekstfil 'example.txt' til en video, transskribere tale fra videoen, tilføje en voiceover ved hjælp af den transskriberede tekst og stabilisere den genererede video."
28344809_4,fr,"Je veux convertir mon fichier texte 'example.txt' en vidéo, transcrire la parole de la vidéo, ajouter une voix off en utilisant le texte transcrit et stabiliser la vidéo générée."
85782550_0,en,Can you generate a panorama from a colorized version of 'example.jpg' and an image created from the text 'Beautiful sunset by the beach'?
85782550_1,en,I want to create a panorama by stitching together a colorized 'example.jpg' and an image generated from the text 'Beautiful sunset by the beach'.
85782550_2,en,"Using the text 'Beautiful sunset by the beach', generate an image. Then colorize 'example.jpg'. Finally, stitch these two images together to create a panorama."
85782550_3,da,Jeg vil gerne lave et panorama ved hjælp af et billede genereret fra teksten 'Beautiful sunset by the beach' og en farvelagt version af det givne sort-hvide billede 'example.jpg'. (Danish)
85782550_4,fr,Je voudrais créer un panorama en utilisant une image générée à partir de la description textuelle 'Beautiful sunset by the beach' et une version colorisée de l'image noir et blanc fournie 'example.jpg'. (French)
28177919_0,en,I need to add 'example.wav' as background music to my 'example.mp4' video and sync the visuals with a voiceover from my script.
28177919_1,en,Can you add the 'example.wav' background music to my 'example.mp4' video and synchronize the voiceover from my script with the visuals?
28177919_2,en,Please add the 'example.wav' background music to my 'example.mp4' video and ensure the voiceover from my script is synced with the visuals.
28177919_3,da,Jeg har en videofil kaldet 'example.mp4' og en baggrundsmusikfil kaldet 'example.wav'. Jeg har også forberedt et manuskript som en tekstfil til voiceover. Jeg vil gerne have baggrundsmusikken tilføjet til videoen og have voiceover synkroniseret med visuals.
28177919_4,fr,J'ai un fichier vidéo appelé 'example.mp4' et un fichier de musique de fond appelé 'example.wav'. J'ai également préparé un script sous forme de fichier texte pour la voix off. Je voudrais ajouter la musique de fond à la vidéo et synchroniser la voix off avec les visuels.
19933662_0,en,"Can you stitch 'example1.jpg' and 'example2.jpg' together, add 'example3.jpg' to make a video, and extract any text from the stitched image?"
19933662_1,en,"I need to combine 'example1.jpg' and 'example2.jpg', create a video by including 'example3.jpg', and get any text from the stitched image."
19933662_2,da,"Jeg vil kombinere 'example1.jpg' og 'example2.jpg' til et enkelt sammensat billede, oprette en diasshowvideo ved at tilføje 'example3.jpg' til det sammensatte billede, og udtrække eventuel tekst til stede i det sammensatte billede."
19933662_3,fr,"Je veux combiner 'example1.jpg' et 'example2.jpg' en une seule image cousue, créer une vidéo de diaporama en ajoutant 'example3.jpg' à l'image cousue, et extraire tout texte présent dans l'image cousue."
27791495_0,en,"Can you help me find and download images that depict the positive environmental aspects mentioned in this Spanish text: 'Los bosques son el pulmón del mundo, purificando el aire y proporcionando vida.'"
27791495_1,en,"I'm looking for images that illustrate the positive aspects of the environment as described in this text: 'Los bosques son el pulmón del mundo, purificando el aire y proporcionando vida.' Can you find and download them for me?"
27791495_2,en,"Here's a text in Spanish: 'Los bosques son el pulmón del mundo, purificando el aire y proporcionando vida.' I need images that show the positive environmental aspects mentioned in it. Can you find and download them?"
27791495_3,da,"Jeg har brug for at finde og downloade billeder relateret til de positive aspekter af miljøet i den givne tekst: 'Los bosques son el pulmón del mundo, purificando el aire y proporcionando vida.'"
27791495_4,fr,"J'ai besoin de trouver et de télécharger des images liées aux aspects positifs de l'environnement dans le texte donné: 'Los bosques son el pulmón del mundo, purificando el aire y proporcionando vida.'"
13875356_0,en,"I want to transcribe a video, rewrite the transcription, extract keywords, and check the grammar"
13875356_1,en,"I need to transcribe a video, spin the transcription, pull out keywords, and correct any grammar mistakes"
13875356_2,en,"I need to transcribe a video, check the grammar of the transcription, rewrite it, and then extract keywords"
13875356_3,da,"Jeg har en video kaldet 'example.mp4'. Jeg vil gerne transskribere tale fra videoen, skabe en unik version af den transskriberede tekst gennem spinning, derefter udtrække de vigtigste nøgleord fra den spunne tekst, og endelig tjekke for eventuelle grammatiske fejl og modtage forslag til rettelser (Danish)"
13875356_4,fr,"J'ai une vidéo nommée 'example.mp4'. Je voudrais transcrire la parole de la vidéo, créer une version unique du texte transcrit en le faisant tourner, puis extraire les mots-clés les plus importants du texte tourné, et enfin vérifier les erreurs grammaticales et recevoir des suggestions de corrections (French)"
33378522_0,en,Can you create an audio narration for my video using the text provided and enhance it with audio effects based on the keywords in the text?
33378522_1,en,"Using the text provided, generate an audio narration for my video and apply audio effects based on the keywords in the text."
33378522_2,en,"I want an audio narration for my video, created from the given text, with audio effects applied based on the keywords extracted from the text."
33378522_3,en,Generate an audio narration for my video from the provided text and enhance it with audio effects derived from the text's keywords.
33378522_4,da,"Jeg har brug for en engagerende lydnarration til min video 'example.mp4', baseret på teksten: 'Dette er en vejledning i, hvordan man planter et træ. Først graver du et hul i jorden og placerer træfrøet i det. Vand det generøst og dæk frøet med jord. Endelig placerer du en beskyttende barriere omkring området for at holde dyr væk.' Anvend også passende lydeffekter baseret på de udtrukne nøgleord for at forbedre lytteoplevelsen."
33378522_5,fr,"J'ai besoin d'une narration audio engageante pour ma vidéo 'example.mp4', basée sur la description textuelle: 'Ceci est un tutoriel sur comment planter un arbre. Tout d'abord, creusez un trou dans le sol et placez la graine de l'arbre dedans. Arrosez-la généreusement et couvrez la graine avec de la terre. Enfin, placez une barrière protectrice autour de la zone pour éloigner les animaux.' De plus, appliquez des effets audio appropriés en fonction des mots-clés extraits pour améliorer l'expérience d'écoute."
13140442_0,en,"I need a simplified text from an audio file, the sentiment of the text, and an image representing the sentiment."
13140442_1,en,"Can you transcribe an audio file, analyze its sentiment, find a related image, and simplify the text?"
13140442_2,en,"I have an audio file and I want to get a simplified version of the text, understand the sentiment, and find an image that matches the sentiment."
13140442_3,en,"Could you help me transcribe an audio file, determine the sentiment of the text, search for a sentiment-related image, and simplify the text?"
13140442_4,da,"Jeg har en lydfil, og jeg vil gerne have en forenklet tekst af, hvad der blev sagt, kende følelsen af, hvad der blev diskuteret, og finde et billede, der repræsenterer følelsen."
13140442_5,fr,"J'ai un fichier audio, et je voudrais obtenir un texte simplifié de ce qui a été dit, connaître le sentiment de ce qui a été discuté, et trouver une image qui représente le sentiment."
28720403_0,en,"Generate a video from the text: 'A cat is playing with a ball in the park', then transcribe the audio into text, and finally adjust the video speed to half"
28720403_1,en,"Create a video from the text: 'A cat is playing with a ball in the park', afterwards extract the audio and transcribe it, and adjust the video speed to half"
28720403_2,en,"From the text: 'A cat is playing with a ball in the park', create a video, extract and transcribe the audio, and adjust the video speed to half"
28720403_3,da,"Opret en video fra teksten: 'En kat leger med en bold i parken', derefter udtræk lyden og transskriber den til tekst, og juster til sidst videohastigheden til at spille med halv hastighed"
28720403_4,fr,"Créez une vidéo à partir du texte: 'Un chat joue avec une balle dans le parc', puis extrayez l'audio et transcrivez-le en texte, et enfin ajustez la vitesse de la vidéo pour jouer à demi-vitesse"
16540993_0,en,Can you expand my short text about a cafe and generate some topics from it?
16540993_1,en,I need to expand my text about a cafe experience and then generate related topics.
16540993_2,en,Could you help me make my text about a cafe more detailed and then generate some topics?
16540993_3,en,I want to make my short text about a cafe longer and then generate some topics.
16540993_4,da,"Jeg har en kort tekst om min oplevelse på en café: 'Havde en fantastisk tid, dejlig atmosfære og venligt personale.' Jeg har brug for en mere detaljeret version af denne tekst og derefter generere nogle relevante emner relateret til den udvidede tekst."
16540993_5,fr,"J'ai un court texte sur mon expérience dans un café : 'Passé un bon moment, ambiance agréable et personnel sympathique.' J'ai besoin d'une version plus détaillée de ce texte et ensuite générer des sujets pertinents liés au texte élargi."
32089993_0,en,"I need to download an audio file from a URL, convert the audio speech into text, create an image from the text, and modify the speed of a video 'example.mp4' based on the text."
32089993_1,en,"Can you help me adjust the speed of a video 'example.mp4' according to the text transcribed from an audio file that I will download from a URL, and also create an image from the text?"
32089993_2,en,"I want to obtain an audio file from a URL, transcribe the speech into text, and use the text to generate an image and to modify the speed of a video 'example.mp4'."
32089993_3,da,"Jeg har brug for at downloade en lydfil fra en URL, konvertere lydtalen til tekst, oprette et billede fra teksten, og ændre hastigheden på en video 'example.mp4' baseret på teksten."
32089993_4,fr,"J'ai besoin de télécharger un fichier audio à partir d'une URL, de convertir le discours audio en texte, de créer une image à partir du texte, et de modifier la vitesse d'une vidéo 'example.mp4' en fonction du texte."
28128488_0,en,Combine an image downloaded from 'https://www.example.com/example.jpg' with an image generated from the English translation of 'Le chat est sur la chaise' into a panorama
28128488_1,en,"Translate 'Le chat est sur la chaise' from French to English, generate an image from the translation, download an image from 'https://www.example.com/example.jpg', and stitch the two images together"
28128488_2,en,Create a panorama by stitching together an image downloaded from 'https://www.example.com/example.jpg' and an image generated from the English translation of 'Le chat est sur la chaise'
28128488_3,da,"Oversæt den franske tekst 'Le chat est sur la chaise' til engelsk, og skab derefter et kombineret panorama billede ved hjælp af denne oversatte tekst og et billede downloadet fra 'https://www.example.com/example.jpg'"
28128488_4,fr,"Traduisez le texte français 'Le chat est sur la chaise' en anglais, puis créez une image panoramique combinée en utilisant ce texte traduit et une image téléchargée à partir de 'https://www.example.com/example.jpg'"
25297988_0,en,I want to create a slideshow video using an image that represents the waveform of my audio file (example.wav) and a still image extracted from my video file (example.mp4).
25297988_1,en,Can you help me create a slideshow video with an image from my audio file (example.wav) and a still image from my video file (example.mp4)?
25297988_2,en,I need to create a slideshow video. The images should be a representation of the waveform of an audio file (example.wav) and a still image from a video file (example.mp4).
25297988_3,da,"Jeg vil gerne lave en diasshow video ved hjælp af et billede, der repræsenterer bølgeformen af min lydfil (example.wav) og et stillbillede udtrukket fra min videofil (example.mp4)."
25297988_4,fr,Je veux créer une vidéo diaporama avec une image représentant la forme d'onde de mon fichier audio (example.wav) et une image fixe extraite de ma vidéo (example.mp4).
32485307_0,en,"I have a text about the history of photography. I want to create a video based on this text. But before that, please check the grammar of the text and rewrite it in a unique way. Also, generate a list of relevant topics related to the text."
32485307_1,en,"Please check the grammar of my text about the history of photography, rewrite it, generate a list of relevant topics, and then create a video based on the rewritten text."
32485307_2,en,"I want to generate a video based on my text about the history of photography. But first, please check the grammar and rewrite the text. Also, provide a list of relevant topics."
32485307_3,no,"Jeg har en tekst om fotografiens historie. Jeg vil gerne lave en video baseret på denne tekst. Men først, tjek venligst grammatikken i teksten og omskriv den på en unik måde. Generer også en liste over relevante emner relateret til teksten."
32485307_4,fr,"J'ai un texte sur l'histoire de la photographie. Je veux créer une vidéo basée sur ce texte. Mais d'abord, veuillez vérifier la grammaire du texte et le réécrire de manière unique. De plus, fournissez une liste de sujets pertinents liés au texte."
24373888_0,en,I need a collage made from a still image from my video 'example.mp4' and a visual representation of my audio file 'example.wav'.
24373888_1,en,Can you help me create a collage that includes a still image from 'example.mp4' and a visual representation of 'example.wav'?
24373888_2,en,I want to make a collage using a still image from 'example.mp4' and a visual representation of 'example.wav'.
24373888_3,en,Can you create a collage with a still image from 'example.mp4' and a visual representation of 'example.wav'?
24373888_4,en,I'm looking to create a collage that has a still image from 'example.mp4' and a visual representation of 'example.wav'.
24373888_5,da,Jeg vil gerne lave en collage ved hjælp af et stillbillede fra 'example.mp4' og en visuel repræsentation af 'example.wav'. (Danish)
24373888_6,fr,Je veux créer un collage avec une image fixe de 'example.mp4' et une représentation visuelle de 'example.wav'. (French)
88103583_0,en,Please paraphrase and analyze the sentiment of this article: 'https://example.com/article'
88103583_1,en,Can you analyze the sentiment and paraphrase the text from this URL: 'https://example.com/article'
88103583_2,en,I need a sentiment analysis and a paraphrase of the text at this URL: 'https://example.com/article'
88103583_3,en,Could you perform a sentiment analysis and paraphrase the article at this link: 'https://example.com/article'
88103583_4,da,Jeg vil gerne analysere følelsen af en artikel og have den omskrevet. URL'en er: 'https://example.com/article'
88103583_5,fr,Je voudrais analyser le sentiment d'un article et le faire paraphraser. L'URL est : 'https://example.com/article'
28222740_0,en,Can you create a summarized transcript of an audio file and an image with text using 'example.jpg' and 'example.wav'?
28222740_1,en,"Using 'example.jpg' and 'example.wav', I need a summarized transcript of an audio file and an image with text."
28222740_2,en,I require a summarized transcript of an audio file and an image with text. Use 'example.jpg' for the image and 'example.wav' for the audio.
28222740_3,da,"Jeg vil gerne lave en opsummeret transkription af en lydfil og et billede indeholdende tekst. Brug billedfilen 'example.jpg' som billedet med tekst, og lydfilen 'example.wav' som lyden."
28222740_4,fr,"Je veux créer une transcription résumée d'un fichier audio et d'une image contenant du texte. Utilisez le fichier image 'example.jpg' comme l'image contenant du texte, et le fichier audio 'example.wav' comme l'audio."
79094671_0,en,"I have a video and a script for a voiceover. I also have a URL for an audio file that I want to use as background music, but it has some noise. Could you download the audio file, reduce the noise, add the voiceover to the video using the script, and then synchronize the audio with the video?"
79094671_1,en,"I need to add a voiceover to a video and also add some background music. The music is in an audio file that you can download from this URL, but it has some noise. Please download the audio file, reduce the noise, add the voiceover to the video using this script, and then synchronize the audio with the video."
79094671_2,da,"Jeg har en video og et manuskript til en voiceover. Jeg har også en URL til en lydfil, som jeg vil bruge som baggrundsmusik, men den har noget støj. Kunne du downloade lydfilen, reducere støjen, tilføje voiceoveren til videoen ved hjælp af manuskriptet, og derefter synkronisere lyden med videoen?"
79094671_3,fr,"J'ai une vidéo et un script pour une voix off. J'ai aussi une URL pour un fichier audio que je veux utiliser comme musique de fond, mais il a du bruit. Pourriez-vous télécharger le fichier audio, réduire le bruit, ajouter la voix off à la vidéo en utilisant le script, puis synchroniser l'audio avec la vidéo?"
20214529_0,en,"Can you speed up my example.mp4 video by 1.5 times, then extract a still image from it and also extract the audio track?"
20214529_1,en,"I need to increase the speed of my example.mp4 video by 1.5 times, in addition to extracting a still image and the audio track from it."
