process_id,language,rephrased_query
36690562_0,en,"Can you pull out the audio from the example.mp4 video, merge it with the example.wav audio file, convert the speech to text, implement the 'add reverb' effect to the combined audio, and create a waveform image for the final audio output?"
36690562_1,en,"I need to apply the 'add reverb' effect to the audio extracted from the example.mp4 video and combined with the example.wav audio file, transcribe the speech, and generate a waveform image."
36690562_2,en,"Extract the audio from the example.mp4 video, combine it with the example.wav audio file, transcribe the speech, apply the 'add reverb' effect, and generate a waveform image."
36690562_3,da,"Jeg vil gerne trække lyden ud af example.mp4 videoen, kombinere den med example.wav lydfilen, transskribere talen, og derefter anvende 'tilføj reverb' effekten til den kombinerede lyd. Endelig vil jeg gerne generere et waveform billede for den endelige lydudgang."
36690562_4,fr,"Je voudrais extraire l'audio de la vidéo example.mp4, le combiner avec le fichier audio example.wav, transcrire le discours, puis appliquer l'effet 'ajouter de la réverbération' à l'audio combiné. Enfin, je voudrais générer une image de forme d'onde pour la sortie audio finale."
27258164_0,en,"Can you change the voice in 'example.wav' to sound like a woman, get rid of the background noise, generate a waveform image of the cleaned audio, and use it with 'example.jpg' to create a slideshow video?"
27258164_1,en,"I'd like the voice in 'example.wav' to be altered to sound like a female, the background noise to be removed, a waveform image to be made from the cleaned audio, and a slideshow video to be created using the waveform image and 'example.jpg'."
27258164_2,en,"Please modify the voice in 'example.wav' to sound like a woman's voice, eliminate the background noise, produce a waveform image from the noise-free audio, and combine it with 'example.jpg' to make a slideshow video."
27258164_3,da,"Jeg vil gerne have, at stemmen i 'example.wav' ændres til at lyde som en kvindes stemme, fjern baggrundsstøjen, lav et waveform-billede af den rensede lyd, og kombiner det med 'example.jpg' for at lave en diasshow-video."
27258164_4,fr,"Je veux modifier la voix dans 'example.wav' pour qu'elle sonne comme une voix de femme et supprimer le bruit de fond. Ensuite, veuillez créer une image de forme d'onde de l'audio modifié et la combiner avec 'example.jpg' pour créer une vidéo de diaporama."
13018270_0,en,I want to merge 'example.wav' and 'example2.wav' and then apply a reverb effect with a 2-second decay and a bass boost of 3dB. Please make sure the instructions are simplified for better understanding.
13018270_1,en,"Can you combine 'example.wav' and 'example2.wav', apply a reverb effect with a 2-second decay and boost the bass frequencies by 3dB? Also, please simplify the instructions."
13018270_2,en,"Please splice 'example.wav' and 'example2.wav', add a reverb effect with a 2-second decay, boost the bass by 3dB, and ensure the instructions are in simple language."
13018270_3,da,"Jeg har en lydfil 'example.wav' og en anden lydfil 'example2.wav'. Jeg vil gerne kombinere dem og anvende følgende lydeffekt: 'Tilføj en rumklangseffekt med en 2-sekunders forfald, efterfulgt af en equalization, der øger basfrekvenserne med 3dB.' Brug venligst simpelt sprog, så værktøjet forstår mine instruktioner bedre."
13018270_4,fr,"J'ai un fichier audio 'example.wav' et un autre fichier audio 'example2.wav'. Je voudrais les combiner et appliquer l'effet audio suivant : 'Ajouter un effet de réverbération avec une décroissance de 2 secondes, suivi d'une égalisation augmentant les fréquences basses de 3dB.' Veuillez utiliser un langage simple pour que l'outil comprenne mieux mes instructions."
15414201_0,en,"I need a birthday video for my friend. I have this idea: 'surprise party in a beautiful garden'. Also, the example.mp4 video should be played at double speed."
15414201_1,en,I'm planning a video for my friend's birthday. The concept is 'surprise party in a beautiful garden'. I wish the example.mp4 video to be played twice as fast.
15414201_2,en,"Can you help me create a birthday video for my friend? I have an idea: 'surprise party in a beautiful garden'. And, I want the example.mp4 video to be sped up."
15414201_3,da,"Jeg vil gerne lave en video til min vens fødselsdag. Jeg har en idé til videoen: 'overraskelsesfest i en smuk have'. Jeg vil gerne have, at example.mp4-videoen afspilles med dobbelt hastighed."
15414201_4,fr,Je veux créer une vidéo pour l'anniversaire de mon ami. J'ai une idée pour la vidéo : 'fête surprise dans un beau jardin'. Je veux que la vidéo example.mp4 soit jouée à double vitesse.
31664374_0,en,"I have a text on gardening tips and a video tutorial on the same. I want the text to be paraphrased, then summarized, and the video speed to be adjusted based on the summary."
31664374_1,en,"In addition to paraphrasing and summarizing a text about gardening tips, I also want to adjust the speed of a gardening tutorial video based on the summarized text."
31664374_2,en,I have a gardening tutorial video and a text on gardening tips. I want the video speed to be adjusted based on the summary of the paraphrased text.
31664374_3,da,"Jeg har en tekst om have tips, og jeg vil gerne have den omskrevet og opsummeret. Derudover har jeg en video 'example.mp4' om have tutorial, og jeg vil gerne justere dens hastighed baseret på den opsummerede tekst."
31664374_4,fr,"J'ai un texte sur les conseils de jardinage, et je voudrais qu'il soit paraphrasé et résumé. De plus, j'ai une vidéo 'example.mp4' sur le tutoriel de jardinage, et je veux ajuster sa vitesse en fonction du texte résumé."
11307128_0,en,"I need to merge 'example1.wav' and 'example2.wav', transcribe the speech from the merged audio, and create a waveform image of it."
11307128_1,en,"Can you help me join 'example1.wav' and 'example2.wav', convert the speech in the joined audio to text, and produce a waveform image of the joined audio?"
11307128_2,en,"Please combine 'example1.wav' and 'example2.wav', transcribe the speech from the combined audio, and generate a waveform image of the combined audio."
11307128_3,en,"Could you help me to combine 'example1.wav' and 'example2.wav', then transcribe the speech from the combined audio into text, and finally generate a waveform image of the combined audio?"
11307128_4,da,"Jeg har to lydfiler, 'example1.wav' og 'example2.wav'. Jeg vil gerne kombinere dem til en enkelt lydfil, transskribere talen i den kombinerede lyd til tekst, og generere et waveform-billede af den kombinerede lyd."
11307128_5,fr,"J'ai deux fichiers audio, 'example1.wav' et 'example2.wav'. Je souhaite les combiner en un seul fichier audio, transcrire le discours dans l'audio combiné en texte, et générer une image de forme d'onde de l'audio combiné."
16333963_0,en,"Can you find a video on 'example', synchronize it with example.wav, stabilize the video, and transcribe the speech?"
16333963_1,en,"I want to search for a video on 'example', sync it with example.wav, stabilize it, and then transcribe the speech to text."
16333963_2,en,"Please search for a video on 'example', synchronize the voiceover from example.wav with it, stabilize the video, and transcribe the speech into text."
16333963_3,en,"Find a video on 'example', sync it with example.wav, stabilize the video, and transcribe the speech to text."
16333963_4,no,"Jeg har brug for at finde en video om 'eksempel', synkronisere en eksisterende voiceover eksempel.wav med videoen, stabilisere videoen og transskribere talen til tekst."
16333963_5,fr,"Je dois trouver une vidéo sur le sujet 'exemple', synchroniser une voix off existante exemple.wav avec la vidéo, stabiliser la vidéo et transcrire la parole en texte."
30160324_0,en,"I have a picture of a French brochure with a URL. Can you help me extract the text and URL, generate a new image from the text, and create a QR code for the URL?"
30160324_1,en,I need help extracting text and a URL from a picture of a French brochure and generating a new image from the text and a QR code for the URL.
30160324_2,en,"Can you assist me in pulling out text and a URL from a picture, producing a new image from the text, and making a QR code for the URL?"
30160324_3,fr,"J'ai une photo d'une brochure française avec une URL. Pouvez-vous m'aider à extraire le texte et l'URL, à générer une nouvelle image à partir du texte et à créer un code QR pour l'URL?"
30160324_4,da,"Jeg har et billede af en fransk brochure med en URL. Kan du hjælpe mig med at trække teksten og URL'en ud, generere et nyt billede fra teksten og oprette en QR-kode til URL'en?"
76244107_0,en,"Can you download an audio file from this URL, transcribe it, synchronize it with a video, and then extract the audio from the video?"
76244107_1,en,"I need to download an audio file, transcribe it into text, synchronize it with a video, and then extract the audio from the synchronized video."
76244107_2,en,"Please download this audio file, transcribe it into text, synchronize it with this video, and then extract the audio from the video."
76244107_3,da,"Kan du downloade en lydfil fra denne URL, transskribere den, synkronisere den med en video, og derefter udtrække lyden fra videoen?"
76244107_4,fr,"Je veux télécharger un fichier audio à partir de cette URL, le transcrire en texte, le synchroniser avec une vidéo, puis extraire l'audio de la vidéo synchronisée."
29216690_0,en,"Can you provide a reworded version of this text, generate an image from the reworded text, and identify any URLs present in the text?"
29216690_1,en,"I need a different version of this text, an image that represents the new text, and any URLs that are in the text."
29216690_2,en,"Could you rewrite this text, create an image based on the rewritten text, and extract any URLs from the text?"
29216690_3,da,"Jeg vil gerne have en omskrevet version af denne tekst: 'Den hurtige brune ræv hopper over den dovne hund', et billede genereret baseret på den omskrevne tekst, og eventuelle hjemmesider fundet inden i teksten."
29216690_4,fr,"Je veux une version paraphrasée de ce texte: 'Le renard brun rapide saute par-dessus le chien paresseux', une image générée à partir du texte paraphrasé, et tous les sites Web trouvés dans le texte."
79560754_0,en,"Can you help me create a video from my text about environmental conservation? But first, please check the grammar, create a summary, and generate some topic ideas."
79560754_1,en,"I have a text about environmental conservation. Could you check the grammar, summarize it, generate some topic ideas, and then create a video from it?"
79560754_2,en,"I need a video created from my text about environmental conservation. Please also check the grammar, summarize the text, and generate some topic ideas."
79560754_3,da,"Jeg har brug for hjælp til at lave en video baseret på min tekst om miljøbevarelse. Kan du tjekke grammatikken, lave et resumé, generere nogle emneideer og endelig lave en video?"
79560754_4,fr,"J'ai besoin d'aide pour créer une vidéo basée sur mon texte sur la conservation de l'environnement. Pouvez-vous vérifier la grammaire, créer un résumé, générer des idées de sujets et enfin créer une vidéo?"
70467871_0,en,"Can you create a slideshow video from example1.jpg and example2.jpg, extract the speech from example.mp4, and use it as a voiceover for the slideshow?"
70467871_1,en,"I want to make a slideshow video with example1.jpg and example2.jpg, then add a voiceover using the speech from example.mp4."
70467871_2,en,"Create a slideshow video using example1.jpg and example2.jpg, transcribe the speech from example.mp4, and add it as a voiceover to the slideshow."
70467871_3,da,"Jeg har brug for at lave en diasshow video med example1.jpg og example2.jpg, og tilføje en voiceover til det ved hjælp af det talte indhold udtrukket fra example.mp4 videoen. (Danish)"
70467871_4,fr,"Je dois créer une vidéo de diaporama en utilisant example1.jpg et example2.jpg, et ajouter une voix off en utilisant le contenu parlé extrait de la vidéo example.mp4. (French)"
11545630_0,en,"Can you download the audio file from this URL, transcribe the speech from this video, search for the audio effects mentioned in the transcription, and apply those effects to the audio file?"
11545630_1,en,"I need you to download an audio file, transcribe a speech from a video, search for the audio effects in the transcription, and apply those effects to the audio file."
11545630_2,en,"Please download the audio file from the provided URL, transcribe the speech from the given video, find the audio effects mentioned in the transcription, and apply those effects to the audio file."
11545630_3,en,"Download the audio file from this URL, transcribe the speech from the video, look for the audio effects in the transcription, and apply those effects to the audio file."
11545630_4,da,"Kan du downloade lydfilen fra denne URL, transskribere talen fra denne video, søge efter lydeffekterne nævnt i transskriptionen, og anvende disse effekter på lydfilen?"
11545630_5,fr,"Veuillez télécharger le fichier audio à partir de cette URL, transcrire le discours de cette vidéo, rechercher les effets audio mentionnés dans la transcription, et appliquer ces effets au fichier audio."
17603966_0,en,"Can you transcribe the speech in my video file 'example.mp4', extract the key phrases and words, find any URLs in the video, and check the keywords for any grammatical errors?"
17603966_1,en,"I need the speech in my video file 'example.mp4' transcribed, the most important keywords and phrases extracted, any URLs in the video found, and the extracted keywords checked for grammatical errors."
17603966_2,en,"Please transcribe the speech in my video 'example.mp4', find the most important keywords and phrases, locate any URLs, and check the grammar of the keywords."
17603966_3,da,"Jeg har en videofil 'example.mp4'. Transkriber venligst talen i videoen, udtræk de vigtigste nøgleord og sætninger, og find også eventuelle URL'er nævnt i videoen. Kontroller desuden de udtrukne nøgleord for grammatiske fejl og foreslå rettelser."
17603966_4,fr,"J'ai un fichier vidéo 'example.mp4'. Veuillez transcrire le discours dans la vidéo, extraire les mots-clés et les phrases les plus importants, et trouver également les URL mentionnées dans la vidéo. De plus, vérifiez les erreurs grammaticales dans les mots-clés extraits et suggérez des corrections."
26579656_0,en,"Download the video from 'example.mp4', stabilize it, extract the audio, and get a still image."
26579656_1,en,"Can you download the video from 'example.mp4', stabilize it, extract the audio, and get a still image?"
26579656_2,en,"I need to download a video from 'example.mp4', stabilize it, get the audio, and also a still image."
26579656_3,en,"Please download the video from 'example.mp4', stabilize it, extract the audio, and retrieve a still image."
26579656_4,da,"Jeg vil gerne downloade videoen fra URL'en 'example.mp4', stabilisere eventuelle rystende dele, udtrække lyden, og også hente et stillbillede fra videoen."
26579656_5,fr,"Je voudrais télécharger la vidéo à partir de l'URL 'example.mp4', stabiliser les parties tremblantes, extraire l'audio, et aussi récupérer une image fixe de la vidéo."
58963254_0,en,"Can you download example.wav and example2.wav, combine them, create an image from the combined audio, extract text from the image, paraphrase the text, extract keywords from the paraphrased text, and generate topics based on the keywords?"
58963254_1,en,"I need to download two audio files, merge them, generate an image from the audio, extract any text from the image, paraphrase the text, identify the main keywords, and suggest topics based on these keywords."
58963254_2,en,"Please download and combine example.wav and example2.wav, generate an image from the audio, extract and paraphrase any text from the image, identify the key phrases, and suggest related topics."
58963254_3,da,"Jeg vil gerne downloade en lydfil fra example.wav og kombinere den med en anden lydfil example2.wav. Derefter generere et billede, der repræsenterer den kombinerede lydbølge og udtrække eventuel tekst på billedet. Derefter omskrive den udtrukne tekst og få de vigtige nøgleord fra den. Endelig foreslå nogle relevante emner baseret på disse nøgleord."
58963254_4,fr,"Je voudrais télécharger un fichier audio de example.wav et le combiner avec un autre fichier audio example2.wav. Ensuite, générer une image représentant la forme d'onde audio combinée et extraire tout texte sur l'image. Ensuite, paraphraser le texte extrait et obtenir les mots clés importants de celui-ci. Enfin, suggérer des sujets pertinents basés sur ces mots clés."
13921012_0,en,"I want to get the audio from my video file (example.mp4) and change its characteristics based on the summary of this text: 'A male speaker with a deep voice and a slow pace of speech is hard to understand. Please change to a higher-pitched, faster-speaking female voice.'"
13921012_1,en,"Can you extract the audio from this video (example.mp4), summarize this text, and then modify the audio based on the summary: 'A male speaker with a deep voice and a slow pace of speech is hard to understand. Please change to a higher-pitched, faster-speaking female voice.'"
13921012_2,en,"Please pull the audio from my video (example.mp4), summarize the following text, and use the summary to change the audio: 'A male speaker with a deep voice and a slow pace of speech is hard to understand. Please change to a higher-pitched, faster-speaking female voice.'"
13921012_3,da,"Jeg har en videofil (example.mp4) og jeg vil gerne trække lydsporet ud fra den. Derudover vil jeg gerne bruge den givne opsummering af min følgende tekst til at ændre lydens karakteristika: 'En mandlig taler med en dyb stemme og en langsom talehastighed er svær at forstå. Skift venligst til en højere, hurtigere talende kvindelig stemme.'"
13921012_4,fr,"J'ai un fichier vidéo (example.mp4) et j'aimerais en extraire la piste audio. De plus, j'aimerais utiliser le résumé fourni de mon texte suivant pour modifier les caractéristiques de l'audio : 'Un orateur masculin à la voix profonde et au rythme de parole lent est difficile à comprendre. Veuillez changer pour une voix féminine plus aiguë et plus rapide.'"
21983458_0,en,I need to make a multimedia presentation using example.jpg and related audio files for better understanding
21983458_1,en,Can you help me create a multimedia presentation with example.jpg and related audio files?
21983458_2,en,I'd like to understand example.jpg better by creating a multimedia presentation with related images and audio files.
21983458_3,da,Jeg vil gerne lave en multimediepræsentation om example.jpg med relaterede billeder og lydfiler for bedre at forstå dens betydning.
21983458_4,fr,Je veux créer une présentation multimédia sur example.jpg avec des images et des fichiers audio associés pour mieux comprendre son importance.
10863709_0,en,"Can you download a video from 'https://www.example.com/video.mp4', get an image from it, make a slideshow with the obtained image and 'example.jpg', stabilize the resulting video, and transcribe its speech into text?"
10863709_1,en,"I need to create a slideshow using an image from a video at 'https://www.example.com/video.mp4' and 'example.jpg', stabilize the video, and get a text transcription of its speech."
10863709_2,en,"Please download a video from 'https://www.example.com/video.mp4', extract an image, use it with 'example.jpg' to generate a slideshow, stabilize the slideshow, and transcribe the speech to text."
10863709_3,da,"Jeg vil gerne downloade en video fra 'https://www.example.com/video.mp4', udtrække et billede fra det, lave et diasshow ved hjælp af det udtrukne billede og 'example.jpg' som jeg giver, stabilisere diasshowvideoen, og endelig transskribere talen fra den stabiliserede diasshowvideo til tekst."
10863709_4,fr,"Je voudrais télécharger une vidéo de 'https://www.example.com/video.mp4', extraire une image de celle-ci, créer un diaporama en utilisant l'image extraite et 'example.jpg' que je fournis, stabiliser la vidéo du diaporama, et enfin transcrire la parole de la vidéo du diaporama stabilisée en texte."
82794359_0,en,"Extract the text from 'example.jpg', use it to create a unique article, find a URL in the article, and apply audio effects to 'example.wav'."
82794359_1,en,"I need you to extract text from an image, generate a new article from that text, find a URL in the article, and apply audio effects to an audio file."
82794359_2,en,"Start by extracting text from 'example.jpg', then use that text to create a new article. From that article, extract a URL and finally apply audio effects to 'example.wav'."
82794359_3,en,"Please perform OCR on 'example.jpg', spin a new article from the extracted text, find a URL in the spun article, and apply audio effects to 'example.wav'."
82794359_4,da,"Udtræk teksten fra 'example.jpg', og skab en ny unik artikel baseret på det. Derefter, udtræk en URL fra den genererede artikel og anvend nogle lydeffekter på 'example.wav' ifølge brugerens instruktioner. (Danish)"
82794359_5,fr,"Veuillez extraire le texte de l'image 'example.jpg', et créer un nouvel article unique basé sur celui-ci. Ensuite, extrayez une URL de l'article généré et appliquez des effets audio sur 'example.wav' selon les instructions de l'utilisateur. (French)"
61036052_0,en,"I have a video URL, I want to download it and convert it to audio. I also want to modify the pitch of the audio according to these instructions, but please simplify them first."
61036052_1,en,"Can you download this video from the URL and convert it to audio? Also, can you modify the pitch of the audio according to these instructions, but make sure to simplify them first."
61036052_2,en,"I need you to download a video from this URL, convert it to audio, and modify the pitch according to these instructions. But before you do that, please simplify the instructions."
61036052_3,da,"Jeg har en video URL, jeg vil gerne have videoen downloadet og konverteret til en lydfil. Jeg vil også gerne have ændret tonen på den ekstraherede lyd i henhold til tekstinstruktionen 'Øg tonen på den ekstraherede lyd med to halvtoner'. Men først, omskriv eller forenkler denne instruktion til enklere ord før stemmeændringen."
61036052_4,fr,"J'ai une URL de vidéo, je voudrais que cette vidéo soit téléchargée et convertie en fichier audio. Ensuite, je veux que le ton de l'audio extrait soit modifié plus haut selon l'instruction textuelle 'Veuillez augmenter le ton de l'audio extrait de deux demi-tons'. Mais d'abord, veuillez reformuler ou simplifier cette instruction en des termes plus simples avant la modification de la voix."
16490659_0,en,"Can you simplify this complex article, extract the main keywords, provide a summary, and also convert it into an audio file? The text file is 'example.txt'."
16490659_1,en,"I need a more understandable version of this article, a summary of that version, and an audio file. The article is in the attached 'example.txt' file."
16490659_2,en,"Please simplify this article, summarize it, and provide an audio version. The article is in 'example.txt'."
16490659_3,en,"I have a complex article in 'example.txt'. Can you simplify it, summarize it, and convert it into an audio file?"
16490659_4,da,"Jeg har en lang, kompleks artikel om avancerede AI-teknologier. Jeg har brug for en forenklet version af artiklen, der fremhæver de vigtigste nøgleord på en mere forståelig måde. Derudover har jeg brug for et resumé af den forenklede version og en lydfil til lytning. Find venligst den tekstfil, jeg vedhæftede: 'example.txt'."
16490659_5,fr,"J'ai un long article complexe sur les technologies avancées de l'IA. J'ai besoin d'une version simplifiée de l'article qui met en évidence les principaux mots-clés dans un langage plus compréhensible. De plus, j'ai besoin d'un résumé de cette version simplifiée et d'un fichier audio pour l'écoute. Veuillez trouver le fichier texte que j'ai joint : 'example.txt'."
18591337_0,en,"Can you simplify this complex text and convert it into a female voice speech, but first remove the noise from this audio file?"
18591337_1,en,"First, reduce the noise from this audio file, then simplify this text and convert it into a female voice speech."
18591337_2,en,"I need the noise from this audio file reduced, the text simplified, and then converted into a female voice speech."
18591337_3,da,"Jeg vil gerne have denne komplekse tekst forenklet og omdannet til tale med en kvindelig stemme, men først skal støjen fra denne lydfil fjernes."
18591337_4,fr,"Je veux simplifier ce texte complexe et le convertir en discours avec une voix féminine, mais d'abord nettoyer le bruit de ce fichier audio."
16243108_0,en,Can you analyze the sentiment of the internet conversation about 'The Turing Test' movie and represent it visually in a mechanical female voice with the style of 'example.jpg'?
16243108_1,en,I'd like to see a visual representation of the sentiment of the online discussion about 'The Turing Test' movie in a robotic female voice. Please use the style of 'example.jpg' for the final image.
16243108_2,en,"Please analyze the sentiment of the online discussion about 'The Turing Test' movie, express it in a robotic female voice, and visualize it. Apply the style of 'example.jpg' to the final image."
16243108_3,da,Jeg vil gerne vide stemningen i den online diskussion om den seneste film 'The Turing Test.' Generer venligst en visuel fremstilling af stemningen med følelsen udtrykt i en robotisk kvindelig stemme. Anvend den visuelle stil fra billedet 'example.jpg' på det endelige resultat.
